{
  "$schema": "https://json-schema.org/draft/2020-12/schema",
  "$id": "https://github.com/KAFKA2306/design/artifacts/content.schema.json",
  "title": "Cross-format artifact content",
  "type": "object",
  "additionalProperties": false,
  "required": ["title", "keyMessage", "facts", "limitations", "nextActions"],
  "properties": {
    "title": { "type": "string", "minLength": 1 },
    "keyMessage": { "type": "string", "minLength": 1 },
    "facts": {
      "type": "array",
      "minItems": 1,
      "items": {
        "type": "object",
        "additionalProperties": false,
        "required": ["id", "label", "kind"],
        "properties": {
          "id": { "type": "string", "minLength": 1, "pattern": "^[a-z0-9][a-z0-9._-]*$" },
          "label": { "type": "string", "minLength": 1 },
          "kind": { "type": "string", "enum": ["actual", "forecast", "hypothesis", "unverified"] },
          "value": { "type": "number" },
          "text": { "type": "string", "minLength": 1 },
          "unit": { "type": "string", "minLength": 1 },
          "source": {
            "type": "object",
            "additionalProperties": false,
            "required": ["name"],
            "properties": {
              "name": { "type": "string", "minLength": 1 },
              "url": { "type": "string", "minLength": 1 },
              "reference": { "type": "string", "minLength": 1 },
              "timestamp": { "type": "string", "minLength": 1 },
              "limitation": { "type": "string", "minLength": 1 }
            }
          }
        },
        "oneOf": [
          { "required": ["value", "unit"] },
          { "required": ["text"] }
        ]
      }
    },
    "limitations": { "type": "array", "items": { "type": "string", "minLength": 1 } },
    "nextActions": { "type": "array", "items": { "type": "string", "minLength": 1 } }
  }
}
